{
  "meta": {
    "project_name": "python-dateutil (parser module)",
    "spec_version": "0.1.0",
    "source_language": "python",
    "source_version": "3.11",
    "created_at": "2026-04-09T14:00:00Z",
    "updated_at": "2026-04-09T14:00:00Z",
    "tools": {
      "treeloom": "0.4.0",
      "veripak": "0.2.0",
      "sanicode": "0.3.0"
    }
  },
  "cpg_ref": {
    "path": "../dateutil-example/cpg.json",
    "sha256": "e3b0c44298fc1c149afbf4c8996fb92427ae41e4649b934ca495991b7852b855",
    "built_at": "2026-04-09T13:45:00Z",
    "treeloom_version": "0.4.0",
    "stats": {
      "nodes": 8039,
      "edges": 17590,
      "files": 17,
      "functions": 306,
      "call_resolution_pct": 34
    }
  },
  "ecosystem_dependencies": [
    {
      "package": "python-dateutil",
      "ecosystem": "python",
      "version_in_use": "2.8.2",
      "latest_version": "2.9.0",
      "cves": [
        {
          "id": "CVE-2022-31688",
          "severity": "MEDIUM",
          "summary": "Denial of service via malformed date strings that cause excessive backtracking in the parser.",
          "affects_versions": "<2.8.2.post1"
        }
      ],
      "eol": {
        "is_eol": false,
        "eol_date": null,
        "confidence": "high"
      },
      "recommendation": "Upgrade to 2.9.0. The CVE is mitigated in 2.8.2.post1+ but upgrading to latest picks up additional hardening and bug fixes.",
      "urgency": "high",
      "metadata": {
        "confidence": "high",
        "source": "static_analysis",
        "status": "extracted",
        "updated_at": "2026-04-09T13:50:00Z",
        "updated_by": "veripak/0.2.0"
      }
    }
  ],
  "security_findings": [
    {
      "node_ref": "function:/Users/wjackson/Developer/dateutil-example/src/dateutil/parser/_parser.py:325:4:100",
      "file": "_parser.py",
      "line": 325,
      "column": 8,
      "rule_id": "SC059",
      "message": "Empty except handler — exception silently swallowed, errors go undetected (CWE-390)",
      "severity": "medium",
      "cwe_id": 390,
      "cwe_name": "Detection of Error Condition Without Action",
      "compliance": {
        "owasp_asvs": [
          {
            "id": "v5.0.0-16.5.1",
            "title": "Generic error messages without sensitive data",
            "level": "L1"
          }
        ],
        "nist_800_53": ["SI-11"],
        "asd_stig": [
          {
            "id": "APSC-DV-002570",
            "cat": "II",
            "title": "The application must not disclose unnecessary information in error responses"
          }
        ],
        "pci_dss": ["6.2.4"]
      },
      "remediation": "Log the swallowed exception at debug level or re-raise as a specific parser warning so callers can detect partial-parse failures.",
      "action": "review",
      "metadata": {
        "confidence": "high",
        "source": "static_analysis",
        "status": "extracted",
        "assigned_to": "human",
        "updated_at": "2026-04-09T13:55:00Z",
        "updated_by": "sanicode/0.3.0",
        "notes": "Derived severity elevated to high: silent swallowing in a parser that handles untrusted input can mask exploitation of CVE-2022-31688."
      }
    },
    {
      "node_ref": "function:/Users/wjackson/Developer/dateutil-example/src/dateutil/parser/_parser.py:332:4:101",
      "file": "_parser.py",
      "line": 332,
      "column": 8,
      "rule_id": "SC059",
      "message": "Empty except handler — exception silently swallowed, errors go undetected (CWE-390)",
      "severity": "medium",
      "cwe_id": 390,
      "cwe_name": "Detection of Error Condition Without Action",
      "compliance": {
        "owasp_asvs": [
          {
            "id": "v5.0.0-16.5.1",
            "title": "Generic error messages without sensitive data",
            "level": "L1"
          }
        ],
        "nist_800_53": ["SI-11"],
        "asd_stig": [
          {
            "id": "APSC-DV-002570",
            "cat": "II",
            "title": "The application must not disclose unnecessary information in error responses"
          }
        ],
        "pci_dss": ["6.2.4"]
      },
      "remediation": "Same pattern as line 325 — add logging or convert to explicit pass-with-comment explaining why the exception is intentionally discarded.",
      "action": "review",
      "metadata": {
        "confidence": "high",
        "source": "static_analysis",
        "status": "extracted",
        "assigned_to": "human",
        "updated_at": "2026-04-09T13:55:00Z",
        "updated_by": "sanicode/0.3.0"
      }
    },
    {
      "node_ref": "function:/Users/wjackson/Developer/dateutil-example/src/dateutil/parser/_parser.py:651:4:102",
      "file": "_parser.py",
      "line": 651,
      "column": 39,
      "rule_id": "SC062",
      "message": "Error detail exposed in exception handler — may leak implementation details to users (CWE-209)",
      "severity": "medium",
      "cwe_id": 209,
      "cwe_name": "Generation of Error Message Containing Sensitive Information",
      "remediation": "Sanitize the error message to avoid echoing back raw input tokens. Return a generic parse-failure message and log the detailed error internally.",
      "action": "review",
      "metadata": {
        "confidence": "high",
        "source": "static_analysis",
        "status": "extracted",
        "assigned_to": "human",
        "updated_at": "2026-04-09T13:55:00Z",
        "updated_by": "sanicode/0.3.0",
        "notes": "Derived severity elevated to high: in a web context, echoing malformed input in an exception message can facilitate XSS or information disclosure."
      }
    },
    {
      "node_ref": "function:/Users/wjackson/Developer/dateutil-example/src/dateutil/parser/_parser.py:223:4:103",
      "file": "_parser.py",
      "line": 223,
      "column": 12,
      "rule_id": "SC050",
      "message": "Dynamic resource modification via globals() or setattr() — an attacker-controlled key can override module attributes (CWE-913)",
      "severity": "high",
      "cwe_id": 913,
      "cwe_name": "Improper Control of Dynamically-Managed Code Resources",
      "remediation": "Replace dynamic attribute assignment with an explicit allowlist of settable attributes. If the dynamic pattern is needed for initialization, validate the key against a known set.",
      "action": "review",
      "metadata": {
        "confidence": "high",
        "source": "static_analysis",
        "status": "extracted",
        "assigned_to": "human",
        "updated_at": "2026-04-09T13:55:00Z",
        "updated_by": "sanicode/0.3.0",
        "notes": "Derived severity medium: the setattr calls are in parserinfo.__init__ and operate on class-internal data, not externally supplied keys. Risk is real but attenuated by the fact that parserinfo is typically instantiated with hardcoded locale data."
      }
    },
    {
      "node_ref": "function:/Users/wjackson/Developer/dateutil-example/src/dateutil/parser/_parser.py:1429:4:104",
      "file": "_parser.py",
      "line": 1429,
      "column": 28,
      "rule_id": "SC050",
      "message": "Dynamic resource modification via globals() or setattr() — an attacker-controlled key can override module attributes (CWE-913)",
      "severity": "high",
      "cwe_id": 913,
      "cwe_name": "Improper Control of Dynamically-Managed Code Resources",
      "remediation": "Constrain dynamic assignment to a known allowlist of attribute names.",
      "action": "review",
      "metadata": {
        "confidence": "high",
        "source": "static_analysis",
        "status": "extracted",
        "updated_at": "2026-04-09T13:55:00Z",
        "updated_by": "sanicode/0.3.0"
      }
    },
    {
      "node_ref": "function:/Users/wjackson/Developer/dateutil-example/src/dateutil/parser/_parser.py:1433:4:105",
      "file": "_parser.py",
      "line": 1433,
      "column": 28,
      "rule_id": "SC050",
      "message": "Dynamic resource modification via globals() or setattr() — an attacker-controlled key can override module attributes (CWE-913)",
      "severity": "high",
      "cwe_id": 913,
      "cwe_name": "Improper Control of Dynamically-Managed Code Resources",
      "remediation": "Constrain dynamic assignment to a known allowlist of attribute names.",
      "action": "review",
      "metadata": {
        "confidence": "high",
        "source": "static_analysis",
        "status": "extracted",
        "updated_at": "2026-04-09T13:55:00Z",
        "updated_by": "sanicode/0.3.0"
      }
    },
    {
      "node_ref": "function:/Users/wjackson/Developer/dateutil-example/src/dateutil/parser/_parser.py:1440:4:106",
      "file": "_parser.py",
      "line": 1440,
      "column": 28,
      "rule_id": "SC050",
      "message": "Dynamic resource modification via globals() or setattr() — an attacker-controlled key can override module attributes (CWE-913)",
      "severity": "high",
      "cwe_id": 913,
      "cwe_name": "Improper Control of Dynamically-Managed Code Resources",
      "remediation": "Constrain dynamic assignment to a known allowlist of attribute names.",
      "action": "review",
      "metadata": {
        "confidence": "high",
        "source": "static_analysis",
        "status": "extracted",
        "updated_at": "2026-04-09T13:55:00Z",
        "updated_by": "sanicode/0.3.0"
      }
    }
  ],
  "elements": {
    "mod:dateutil.parser": {
      "hierarchy_level": "module",
      "node_ref": "module:/Users/wjackson/Developer/dateutil-example/src/dateutil/parser/__init__.py:1:0:100",
      "name": "dateutil.parser",
      "file": "/Users/wjackson/Developer/dateutil-example/src/dateutil/parser/__init__.py",
      "line": 1,
      "contract": {